"No.","Time","Source","Destination","Protocol","Length","Info"
"17","0.021291274","192.168.2.142","37.120.165.226","TCP","74","45294  >  443 [SYN] Seq=0 Win=64240 Len=0 MSS=1460 SACK_PERM=1 TSval=1154566830 TSecr=0 WS=128"
"22","0.028340446","37.120.165.226","192.168.2.142","TCP","66","443  >  45294 [SYN, ACK] Seq=0 Ack=1 Win=29200 Len=0 MSS=1460 SACK_PERM=1 WS=128"
"23","0.028356402","192.168.2.142","37.120.165.226","TCP","54","45294  >  443 [ACK] Seq=1 Ack=1 Win=64256 Len=0"
"25","0.032381401","192.168.2.142","37.120.165.226","TLSv1.2","571","Client Hello"
"26","0.032700414","37.120.165.226","192.168.2.142","TCP","60","443  >  45294 [ACK] Seq=1 Ack=518 Win=30336 Len=0"
"91","0.781685726","37.120.165.226","192.168.2.142","TLSv1.2","208","Server Hello, Change Cipher Spec, Encrypted Handshake Message"
"92","0.781718458","192.168.2.142","37.120.165.226","TCP","54","45294  >  443 [ACK] Seq=518 Ack=155 Win=64128 Len=0"
"93","0.787376131","192.168.2.142","37.120.165.226","TLSv1.2","105","Change Cipher Spec, Encrypted Handshake Message"
"94","0.787546810","37.120.165.226","192.168.2.142","TCP","60","443  >  45294 [ACK] Seq=155 Ack=569 Win=30336 Len=0"
"95","0.788960854","192.168.2.142","37.120.165.226","TLSv1.2","231","Application Data"
"96","0.789315248","37.120.165.226","192.168.2.142","TCP","60","443  >  45294 [ACK] Seq=155 Ack=746 Win=31360 Len=0"
"104","0.998487824","37.120.165.226","192.168.2.142","TLSv1.2","123","Application Data"
"105","1.011992745","192.168.2.142","37.120.165.226","TLSv1.2","92","Application Data"
"106","1.012460620","37.120.165.226","192.168.2.142","TCP","60","443  >  45294 [ACK] Seq=224 Ack=784 Win=31360 Len=0"
"169","1.217953144","37.120.165.226","192.168.2.142","TLSv1.2","92","Application Data"
"170","1.259114577","192.168.2.142","37.120.165.226","TCP","54","45294  >  443 [ACK] Seq=784 Ack=262 Win=64128 Len=0"
"189","1.460543493","192.168.2.142","37.120.165.226","TLSv1.2","374","Application Data"
"190","1.460826982","37.120.165.226","192.168.2.142","TCP","60","443  >  45294 [ACK] Seq=262 Ack=1104 Win=32512 Len=0"
"191","1.676022074","37.120.165.226","192.168.2.142","TCP","1514","443  >  45294 [ACK] Seq=262 Ack=1104 Win=32512 Len=1460 [TCP segment of a reassembled PDU]"
"192","1.676066156","192.168.2.142","37.120.165.226","TCP","54","45294  >  443 [ACK] Seq=1104 Ack=1722 Win=64128 Len=0"
"193","1.676409145","37.120.165.226","192.168.2.142","TCP","4434","443  >  45294 [ACK] Seq=1722 Ack=1104 Win=32512 Len=4380 [TCP segment of a reassembled PDU]"
"194","1.676431565","192.168.2.142","37.120.165.226","TCP","54","45294  >  443 [ACK] Seq=1104 Ack=6102 Win=62592 Len=0"
"195","1.676492240","37.120.165.226","192.168.2.142","TCP","1514","443  >  45294 [ACK] Seq=6102 Ack=1104 Win=32512 Len=1460 [TCP segment of a reassembled PDU]"
"196","1.676500927","192.168.2.142","37.120.165.226","TCP","54","45294  >  443 [ACK] Seq=1104 Ack=7562 Win=61568 Len=0"
"197","1.676586818","37.120.165.226","192.168.2.142","TCP","1514","443  >  45294 [PSH, ACK] Seq=7562 Ack=1104 Win=32512 Len=1460 [TCP segment of a reassembled PDU]"
"198","1.676595546","192.168.2.142","37.120.165.226","TCP","54","45294  >  443 [ACK] Seq=1104 Ack=9022 Win=60672 Len=0"
"199","1.676707429","37.120.165.226","192.168.2.142","TCP","1514","443  >  45294 [ACK] Seq=9022 Ack=1104 Win=32512 Len=1460 [TCP segment of a reassembled PDU]"
"200","1.676716490","192.168.2.142","37.120.165.226","TCP","54","45294  >  443 [ACK] Seq=1104 Ack=10482 Win=59648 Len=0"
"201","1.676838375","37.120.165.226","192.168.2.142","TCP","1514","443  >  45294 [ACK] Seq=10482 Ack=1104 Win=32512 Len=1460 [TCP segment of a reassembled PDU]"
"202","1.676849538","192.168.2.142","37.120.165.226","TCP","54","45294  >  443 [ACK] Seq=1104 Ack=11942 Win=58752 Len=0"
"203","1.677044860","37.120.165.226","192.168.2.142","TCP","1514","443  >  45294 [ACK] Seq=11942 Ack=1104 Win=32512 Len=1460 [TCP segment of a reassembled PDU]"
"204","1.677055318","192.168.2.142","37.120.165.226","TCP","54","45294  >  443 [ACK] Seq=1104 Ack=13402 Win=64128 Len=0"
"205","1.677205107","37.120.165.226","192.168.2.142","TCP","1514","443  >  45294 [PSH, ACK] Seq=13402 Ack=1104 Win=32512 Len=1460 [TCP segment of a reassembled PDU]"
"206","1.677214371","192.168.2.142","37.120.165.226","TCP","54","45294  >  443 [ACK] Seq=1104 Ack=14862 Win=64128 Len=0"
"207","1.881423331","37.120.165.226","192.168.2.142","TCP","1514","443  >  45294 [PSH, ACK] Seq=14862 Ack=1104 Win=32512 Len=1460 [TCP segment of a reassembled PDU]"
"208","1.881445250","192.168.2.142","37.120.165.226","TCP","54","45294  >  443 [ACK] Seq=1104 Ack=16322 Win=64128 Len=0"
"209","1.881667286","37.120.165.226","192.168.2.142","TLSv1.2","1514","Application Data, Application Data"
"210","1.881677991","192.168.2.142","37.120.165.226","TCP","54","45294  >  443 [ACK] Seq=1104 Ack=17782 Win=64128 Len=0"
"211","1.881744367","37.120.165.226","192.168.2.142","TCP","1514","443  >  45294 [ACK] Seq=17782 Ack=1104 Win=32512 Len=1460 [TCP segment of a reassembled PDU]"
"212","1.881753660","192.168.2.142","37.120.165.226","TCP","54","45294  >  443 [ACK] Seq=1104 Ack=19242 Win=63488 Len=0"
"213","1.881848160","37.120.165.226","192.168.2.142","TCP","1514","443  >  45294 [ACK] Seq=19242 Ack=1104 Win=32512 Len=1460 [TCP segment of a reassembled PDU]"
"214","1.881857362","192.168.2.142","37.120.165.226","TCP","54","45294  >  443 [ACK] Seq=1104 Ack=20702 Win=62592 Len=0"
"215","1.882304705","37.120.165.226","192.168.2.142","TCP","4434","443  >  45294 [ACK] Seq=20702 Ack=1104 Win=32512 Len=4380 [TCP segment of a reassembled PDU]"
"216","1.882317019","192.168.2.142","37.120.165.226","TCP","54","45294  >  443 [ACK] Seq=1104 Ack=25082 Win=62592 Len=0"
"217","1.882488236","37.120.165.226","192.168.2.142","TCP","1514","443  >  45294 [PSH, ACK] Seq=25082 Ack=1104 Win=32512 Len=1460 [TCP segment of a reassembled PDU]"
"218","1.882497990","192.168.2.142","37.120.165.226","TCP","54","45294  >  443 [ACK] Seq=1104 Ack=26542 Win=61568 Len=0"
"219","1.882518641","37.120.165.226","192.168.2.142","TCP","1514","443  >  45294 [ACK] Seq=26542 Ack=1104 Win=32512 Len=1460 [TCP segment of a reassembled PDU]"
"220","1.882525647","192.168.2.142","37.120.165.226","TCP","54","45294  >  443 [ACK] Seq=1104 Ack=28002 Win=60672 Len=0"
"221","1.882612458","37.120.165.226","192.168.2.142","TCP","1514","443  >  45294 [ACK] Seq=28002 Ack=1104 Win=32512 Len=1460 [TCP segment of a reassembled PDU]"
"222","1.882622424","192.168.2.142","37.120.165.226","TCP","54","45294  >  443 [ACK] Seq=1104 Ack=29462 Win=59648 Len=0"
"223","1.882672370","37.120.165.226","192.168.2.142","TCP","1514","443  >  45294 [ACK] Seq=29462 Ack=1104 Win=32512 Len=1460 [TCP segment of a reassembled PDU]"
"224","1.882862155","37.120.165.226","192.168.2.142","TCP","1514","443  >  45294 [ACK] Seq=30922 Ack=1104 Win=32512 Len=1460 [TCP segment of a reassembled PDU]"
"225","1.882971701","37.120.165.226","192.168.2.142","TLSv1.2","1514","Application Data, Application Data"
"226","1.883102181","37.120.165.226","192.168.2.142","TCP","1514","443  >  45294 [PSH, ACK] Seq=33842 Ack=1104 Win=32512 Len=1460 [TCP segment of a reassembled PDU]"
"227","1.883220436","37.120.165.226","192.168.2.142","TCP","1514","443  >  45294 [ACK] Seq=35302 Ack=1104 Win=32512 Len=1460 [TCP segment of a reassembled PDU]"
"228","1.883351251","37.120.165.226","192.168.2.142","TCP","1514","443  >  45294 [ACK] Seq=36762 Ack=1104 Win=32512 Len=1460 [TCP segment of a reassembled PDU]"
"229","1.883465719","37.120.165.226","192.168.2.142","TCP","1514","443  >  45294 [ACK] Seq=38222 Ack=1104 Win=32512 Len=1460 [TCP segment of a reassembled PDU]"
"230","1.883597337","37.120.165.226","192.168.2.142","TCP","1514","443  >  45294 [ACK] Seq=39682 Ack=1104 Win=32512 Len=1460 [TCP segment of a reassembled PDU]"
"231","1.883709358","37.120.165.226","192.168.2.142","TCP","1514","443  >  45294 [ACK] Seq=41142 Ack=1104 Win=32512 Len=1460 [TCP segment of a reassembled PDU]"
"232","1.883840730","37.120.165.226","192.168.2.142","TCP","1514","443  >  45294 [PSH, ACK] Seq=42602 Ack=1104 Win=32512 Len=1460 [TCP segment of a reassembled PDU]"
"233","1.885228052","192.168.2.142","37.120.165.226","TCP","54","45294  >  443 [ACK] Seq=1104 Ack=44062 Win=50048 Len=0"
"234","2.100753622","37.120.165.226","192.168.2.142","TCP","1514","443  >  45294 [PSH, ACK] Seq=44062 Ack=1104 Win=32512 Len=1460 [TCP segment of a reassembled PDU]"
"235","2.100786817","192.168.2.142","37.120.165.226","TCP","54","45294  >  443 [ACK] Seq=1104 Ack=45522 Win=64128 Len=0"
"236","2.100912056","37.120.165.226","192.168.2.142","TCP","1514","443  >  45294 [PSH, ACK] Seq=45522 Ack=1104 Win=32512 Len=1460 [TCP segment of a reassembled PDU]"
"237","2.100925113","192.168.2.142","37.120.165.226","TCP","54","45294  >  443 [ACK] Seq=1104 Ack=46982 Win=63488 Len=0"
"238","2.104098602","37.120.165.226","192.168.2.142","TCP","1514","443  >  45294 [PSH, ACK] Seq=46982 Ack=1104 Win=32512 Len=1460 [TCP segment of a reassembled PDU]"
"239","2.104109694","192.168.2.142","37.120.165.226","TCP","54","45294  >  443 [ACK] Seq=1104 Ack=48442 Win=64128 Len=0"
"240","2.104267683","37.120.165.226","192.168.2.142","TLSv1.2","1514","Application Data, Application Data"
"241","2.104277500","192.168.2.142","37.120.165.226","TCP","54","45294  >  443 [ACK] Seq=1104 Ack=49902 Win=64128 Len=0"
"242","2.104576256","37.120.165.226","192.168.2.142","TCP","1514","443  >  45294 [PSH, ACK] Seq=49902 Ack=1104 Win=32512 Len=1460 [TCP segment of a reassembled PDU]"
"243","2.104585678","192.168.2.142","37.120.165.226","TCP","54","45294  >  443 [ACK] Seq=1104 Ack=51362 Win=64128 Len=0"
"244","2.104833860","37.120.165.226","192.168.2.142","TCP","1514","443  >  45294 [PSH, ACK] Seq=51362 Ack=1104 Win=32512 Len=1460 [TCP segment of a reassembled PDU]"
"245","2.104843416","192.168.2.142","37.120.165.226","TCP","54","45294  >  443 [ACK] Seq=1104 Ack=52822 Win=63488 Len=0"
"246","2.105013284","37.120.165.226","192.168.2.142","TCP","1514","443  >  45294 [ACK] Seq=52822 Ack=1104 Win=32512 Len=1460 [TCP segment of a reassembled PDU]"
"247","2.105023351","192.168.2.142","37.120.165.226","TCP","54","45294  >  443 [ACK] Seq=1104 Ack=54282 Win=62592 Len=0"
"248","2.105186176","37.120.165.226","192.168.2.142","TCP","1514","443  >  45294 [PSH, ACK] Seq=54282 Ack=1104 Win=32512 Len=1460 [TCP segment of a reassembled PDU]"
"249","2.105195759","192.168.2.142","37.120.165.226","TCP","54","45294  >  443 [ACK] Seq=1104 Ack=55742 Win=61568 Len=0"
"250","2.105311065","37.120.165.226","192.168.2.142","TCP","1514","443  >  45294 [PSH, ACK] Seq=55742 Ack=1104 Win=32512 Len=1460 [TCP segment of a reassembled PDU]"
"251","2.105320853","192.168.2.142","37.120.165.226","TCP","54","45294  >  443 [ACK] Seq=1104 Ack=57202 Win=60672 Len=0"
"252","2.105472397","37.120.165.226","192.168.2.142","TCP","1514","443  >  45294 [PSH, ACK] Seq=57202 Ack=1104 Win=32512 Len=1460 [TCP segment of a reassembled PDU]"
"253","2.105480771","192.168.2.142","37.120.165.226","TCP","54","45294  >  443 [ACK] Seq=1104 Ack=58662 Win=59648 Len=0"
"254","2.105878420","37.120.165.226","192.168.2.142","TCP","1514","443  >  45294 [PSH, ACK] Seq=58662 Ack=1104 Win=32512 Len=1460 [TCP segment of a reassembled PDU]"
"255","2.105887726","192.168.2.142","37.120.165.226","TCP","54","45294  >  443 [ACK] Seq=1104 Ack=60122 Win=64128 Len=0"
"256","2.106038163","37.120.165.226","192.168.2.142","TCP","1514","443  >  45294 [PSH, ACK] Seq=60122 Ack=1104 Win=32512 Len=1460 [TCP segment of a reassembled PDU]"
"257","2.106047472","192.168.2.142","37.120.165.226","TCP","54","45294  >  443 [ACK] Seq=1104 Ack=61582 Win=64128 Len=0"
"258","2.106305772","37.120.165.226","192.168.2.142","TCP","1514","443  >  45294 [ACK] Seq=61582 Ack=1104 Win=32512 Len=1460 [TCP segment of a reassembled PDU]"
"259","2.106315569","192.168.2.142","37.120.165.226","TCP","54","45294  >  443 [ACK] Seq=1104 Ack=63042 Win=64128 Len=0"
"260","2.106468223","37.120.165.226","192.168.2.142","TCP","1514","443  >  45294 [PSH, ACK] Seq=63042 Ack=1104 Win=32512 Len=1460 [TCP segment of a reassembled PDU]"
"261","2.106477163","192.168.2.142","37.120.165.226","TCP","54","45294  >  443 [ACK] Seq=1104 Ack=64502 Win=64128 Len=0"
"262","2.106497724","37.120.165.226","192.168.2.142","TCP","1514","443  >  45294 [PSH, ACK] Seq=64502 Ack=1104 Win=32512 Len=1460 [TCP segment of a reassembled PDU]"
"263","2.106504658","192.168.2.142","37.120.165.226","TCP","54","45294  >  443 [ACK] Seq=1104 Ack=65962 Win=63488 Len=0"
"264","2.106775823","37.120.165.226","192.168.2.142","TLSv1.2","1514","Application Data, Application Data, Application Data"
"265","2.106785099","192.168.2.142","37.120.165.226","TCP","54","45294  >  443 [ACK] Seq=1104 Ack=67422 Win=67072 Len=0"
"266","2.107028447","37.120.165.226","192.168.2.142","TCP","1514","443  >  45294 [PSH, ACK] Seq=67422 Ack=1104 Win=32512 Len=1460 [TCP segment of a reassembled PDU]"
"267","2.107037553","192.168.2.142","37.120.165.226","TCP","54","45294  >  443 [ACK] Seq=1104 Ack=68882 Win=70016 Len=0"
"268","2.107213404","37.120.165.226","192.168.2.142","TCP","1514","443  >  45294 [PSH, ACK] Seq=68882 Ack=1104 Win=32512 Len=1460 [TCP segment of a reassembled PDU]"
"269","2.107222619","192.168.2.142","37.120.165.226","TCP","54","45294  >  443 [ACK] Seq=1104 Ack=70342 Win=72960 Len=0"
"270","2.107510387","37.120.165.226","192.168.2.142","TCP","1514","443  >  45294 [PSH, ACK] Seq=70342 Ack=1104 Win=32512 Len=1460 [TCP segment of a reassembled PDU]"
"271","2.107519974","192.168.2.142","37.120.165.226","TCP","54","45294  >  443 [ACK] Seq=1104 Ack=71802 Win=75776 Len=0"
"272","2.108004662","37.120.165.226","192.168.2.142","TCP","1514","443  >  45294 [ACK] Seq=71802 Ack=1104 Win=32512 Len=1460 [TCP segment of a reassembled PDU]"
"273","2.108014221","192.168.2.142","37.120.165.226","TCP","54","45294  >  443 [ACK] Seq=1104 Ack=73262 Win=78720 Len=0"
"274","2.108143357","37.120.165.226","192.168.2.142","TCP","1514","443  >  45294 [ACK] Seq=73262 Ack=1104 Win=32512 Len=1460 [TCP segment of a reassembled PDU]"
"275","2.108152752","192.168.2.142","37.120.165.226","TCP","54","45294  >  443 [ACK] Seq=1104 Ack=74722 Win=81664 Len=0"
"276","2.108244810","37.120.165.226","192.168.2.142","TCP","1514","443  >  45294 [PSH, ACK] Seq=74722 Ack=1104 Win=32512 Len=1460 [TCP segment of a reassembled PDU]"
"277","2.108253478","192.168.2.142","37.120.165.226","TCP","54","45294  >  443 [ACK] Seq=1104 Ack=76182 Win=84608 Len=0"
"278","2.108551000","37.120.165.226","192.168.2.142","TCP","1514","443  >  45294 [PSH, ACK] Seq=76182 Ack=1104 Win=32512 Len=1460 [TCP segment of a reassembled PDU]"
"279","2.108560285","192.168.2.142","37.120.165.226","TCP","54","45294  >  443 [ACK] Seq=1104 Ack=77642 Win=87552 Len=0"
"280","2.108581472","37.120.165.226","192.168.2.142","TCP","1514","443  >  45294 [PSH, ACK] Seq=77642 Ack=1104 Win=32512 Len=1460 [TCP segment of a reassembled PDU]"
"281","2.108588105","192.168.2.142","37.120.165.226","TCP","54","45294  >  443 [ACK] Seq=1104 Ack=79102 Win=90368 Len=0"
"282","2.108738313","37.120.165.226","192.168.2.142","TCP","1514","443  >  45294 [PSH, ACK] Seq=79102 Ack=1104 Win=32512 Len=1460 [TCP segment of a reassembled PDU]"
"283","2.108747374","192.168.2.142","37.120.165.226","TCP","54","45294  >  443 [ACK] Seq=1104 Ack=80562 Win=93312 Len=0"
"284","2.108898761","37.120.165.226","192.168.2.142","TCP","1514","443  >  45294 [PSH, ACK] Seq=80562 Ack=1104 Win=32512 Len=1460 [TCP segment of a reassembled PDU]"
"285","2.108907778","192.168.2.142","37.120.165.226","TCP","54","45294  >  443 [ACK] Seq=1104 Ack=82022 Win=96256 Len=0"
"286","2.109232908","37.120.165.226","192.168.2.142","TCP","1514","443  >  45294 [PSH, ACK] Seq=82022 Ack=1104 Win=32512 Len=1460 [TCP segment of a reassembled PDU]"
"287","2.109242256","192.168.2.142","37.120.165.226","TCP","54","45294  >  443 [ACK] Seq=1104 Ack=83482 Win=99200 Len=0"
"288","2.109394095","37.120.165.226","192.168.2.142","TLSv1.2","1514","Application Data, Application Data"
"289","2.109403028","192.168.2.142","37.120.165.226","TCP","54","45294  >  443 [ACK] Seq=1104 Ack=84942 Win=102144 Len=0"
"290","2.109723773","37.120.165.226","192.168.2.142","TCP","1514","443  >  45294 [PSH, ACK] Seq=84942 Ack=1104 Win=32512 Len=1460 [TCP segment of a reassembled PDU]"
"291","2.109733407","192.168.2.142","37.120.165.226","TCP","54","45294  >  443 [ACK] Seq=1104 Ack=86402 Win=104960 Len=0"
"292","2.109979741","37.120.165.226","192.168.2.142","TCP","1514","443  >  45294 [ACK] Seq=86402 Ack=1104 Win=32512 Len=1460 [TCP segment of a reassembled PDU]"
"293","2.109989407","192.168.2.142","37.120.165.226","TCP","54","45294  >  443 [ACK] Seq=1104 Ack=87862 Win=107904 Len=0"
"294","2.110083027","37.120.165.226","192.168.2.142","TCP","1514","443  >  45294 [PSH, ACK] Seq=87862 Ack=1104 Win=32512 Len=1460 [TCP segment of a reassembled PDU]"
"295","2.110092079","192.168.2.142","37.120.165.226","TCP","54","45294  >  443 [ACK] Seq=1104 Ack=89322 Win=110848 Len=0"
"296","2.110457140","37.120.165.226","192.168.2.142","TCP","1514","443  >  45294 [PSH, ACK] Seq=89322 Ack=1104 Win=32512 Len=1460 [TCP segment of a reassembled PDU]"
"297","2.110466195","192.168.2.142","37.120.165.226","TCP","54","45294  >  443 [ACK] Seq=1104 Ack=90782 Win=113792 Len=0"
"298","2.110480839","37.120.165.226","192.168.2.142","TCP","1514","443  >  45294 [PSH, ACK] Seq=90782 Ack=1104 Win=32512 Len=1460 [TCP segment of a reassembled PDU]"
"299","2.110487347","192.168.2.142","37.120.165.226","TCP","54","45294  >  443 [ACK] Seq=1104 Ack=92242 Win=116736 Len=0"
"300","2.110627672","37.120.165.226","192.168.2.142","TCP","1514","443  >  45294 [PSH, ACK] Seq=92242 Ack=1104 Win=32512 Len=1460 [TCP segment of a reassembled PDU]"
"301","2.110636770","192.168.2.142","37.120.165.226","TCP","54","45294  >  443 [ACK] Seq=1104 Ack=93702 Win=119680 Len=0"
"302","2.111474521","37.120.165.226","192.168.2.142","TCP","1514","443  >  45294 [PSH, ACK] Seq=93702 Ack=1104 Win=32512 Len=1460 [TCP segment of a reassembled PDU]"
"303","2.111485055","192.168.2.142","37.120.165.226","TCP","54","45294  >  443 [ACK] Seq=1104 Ack=95162 Win=122496 Len=0"
"304","2.111532937","37.120.165.226","192.168.2.142","TCP","1514","443  >  45294 [PSH, ACK] Seq=95162 Ack=1104 Win=32512 Len=1460 [TCP segment of a reassembled PDU]"
"305","2.111541362","192.168.2.142","37.120.165.226","TCP","54","45294  >  443 [ACK] Seq=1104 Ack=96622 Win=125440 Len=0"
"306","2.111578053","37.120.165.226","192.168.2.142","TCP","1514","443  >  45294 [PSH, ACK] Seq=96622 Ack=1104 Win=32512 Len=1460 [TCP segment of a reassembled PDU]"
"307","2.111585884","192.168.2.142","37.120.165.226","TCP","54","45294  >  443 [ACK] Seq=1104 Ack=98082 Win=128384 Len=0"
"308","2.111625618","37.120.165.226","192.168.2.142","TCP","1514","443  >  45294 [PSH, ACK] Seq=98082 Ack=1104 Win=32512 Len=1460 [TCP segment of a reassembled PDU]"
"309","2.111636461","192.168.2.142","37.120.165.226","TCP","54","45294  >  443 [ACK] Seq=1104 Ack=99542 Win=131328 Len=0"
"310","2.111939654","37.120.165.226","192.168.2.142","TLSv1.2","1514","Application Data, Application Data"
"311","2.111949267","192.168.2.142","37.120.165.226","TCP","54","45294  >  443 [ACK] Seq=1104 Ack=101002 Win=134272 Len=0"
"312","2.112053111","37.120.165.226","192.168.2.142","TCP","1514","443  >  45294 [PSH, ACK] Seq=101002 Ack=1104 Win=32512 Len=1460 [TCP segment of a reassembled PDU]"
"313","2.112063746","192.168.2.142","37.120.165.226","TCP","54","45294  >  443 [ACK] Seq=1104 Ack=102462 Win=137088 Len=0"
"314","2.324164810","37.120.165.226","192.168.2.142","TCP","1514","443  >  45294 [ACK] Seq=102462 Ack=1104 Win=32512 Len=1460 [TCP segment of a reassembled PDU]"
"315","2.324195498","192.168.2.142","37.120.165.226","TCP","54","45294  >  443 [ACK] Seq=1104 Ack=103922 Win=140032 Len=0"
"316","2.324269261","37.120.165.226","192.168.2.142","TCP","1514","443  >  45294 [PSH, ACK] Seq=103922 Ack=1104 Win=32512 Len=1460 [TCP segment of a reassembled PDU]"
"317","2.324280675","192.168.2.142","37.120.165.226","TCP","54","45294  >  443 [ACK] Seq=1104 Ack=105382 Win=142976 Len=0"
"318","2.324583140","37.120.165.226","192.168.2.142","TCP","1514","443  >  45294 [ACK] Seq=105382 Ack=1104 Win=32512 Len=1460 [TCP segment of a reassembled PDU]"
"319","2.324593027","192.168.2.142","37.120.165.226","TCP","54","45294  >  443 [ACK] Seq=1104 Ack=106842 Win=145920 Len=0"
"320","2.324728385","37.120.165.226","192.168.2.142","TCP","1514","443  >  45294 [PSH, ACK] Seq=106842 Ack=1104 Win=32512 Len=1460 [TCP segment of a reassembled PDU]"
"321","2.324737532","192.168.2.142","37.120.165.226","TCP","54","45294  >  443 [ACK] Seq=1104 Ack=108302 Win=148864 Len=0"
"322","2.324762248","37.120.165.226","192.168.2.142","TCP","1514","443  >  45294 [ACK] Seq=108302 Ack=1104 Win=32512 Len=1460 [TCP segment of a reassembled PDU]"
"323","2.324773795","192.168.2.142","37.120.165.226","TCP","54","45294  >  443 [ACK] Seq=1104 Ack=109762 Win=151680 Len=0"
"324","2.324915816","37.120.165.226","192.168.2.142","TCP","1514","443  >  45294 [PSH, ACK] Seq=109762 Ack=1104 Win=32512 Len=1460 [TCP segment of a reassembled PDU]"
"325","2.324924867","192.168.2.142","37.120.165.226","TCP","54","45294  >  443 [ACK] Seq=1104 Ack=111222 Win=154624 Len=0"
"326","2.325058670","37.120.165.226","192.168.2.142","TCP","1514","443  >  45294 [PSH, ACK] Seq=111222 Ack=1104 Win=32512 Len=1460 [TCP segment of a reassembled PDU]"
"327","2.325067370","192.168.2.142","37.120.165.226","TCP","54","45294  >  443 [ACK] Seq=1104 Ack=112682 Win=157568 Len=0"
"328","2.325305625","37.120.165.226","192.168.2.142","TCP","1514","443  >  45294 [PSH, ACK] Seq=112682 Ack=1104 Win=32512 Len=1460 [TCP segment of a reassembled PDU]"
"329","2.325314728","192.168.2.142","37.120.165.226","TCP","54","45294  >  443 [ACK] Seq=1104 Ack=114142 Win=160512 Len=0"
"330","2.325553169","37.120.165.226","192.168.2.142","TCP","1514","443  >  45294 [PSH, ACK] Seq=114142 Ack=1104 Win=32512 Len=1460 [TCP segment of a reassembled PDU]"
"331","2.325562196","192.168.2.142","37.120.165.226","TCP","54","45294  >  443 [ACK] Seq=1104 Ack=115602 Win=163456 Len=0"
"332","2.325797577","37.120.165.226","192.168.2.142","TLSv1.2","1514","Application Data, Application Data"
"333","2.325806586","192.168.2.142","37.120.165.226","TCP","54","45294  >  443 [ACK] Seq=1104 Ack=117062 Win=166400 Len=0"
"334","2.328821766","37.120.165.226","192.168.2.142","TCP","1514","443  >  45294 [PSH, ACK] Seq=117062 Ack=1104 Win=32512 Len=1460 [TCP segment of a reassembled PDU]"
"335","2.328832151","192.168.2.142","37.120.165.226","TCP","54","45294  >  443 [ACK] Seq=1104 Ack=118522 Win=169216 Len=0"
"336","2.328855629","37.120.165.226","192.168.2.142","TCP","1514","443  >  45294 [PSH, ACK] Seq=118522 Ack=1104 Win=32512 Len=1460 [TCP segment of a reassembled PDU]"
"337","2.328862743","192.168.2.142","37.120.165.226","TCP","54","45294  >  443 [ACK] Seq=1104 Ack=119982 Win=172160 Len=0"
"338","2.328876340","37.120.165.226","192.168.2.142","TCP","1514","443  >  45294 [PSH, ACK] Seq=119982 Ack=1104 Win=32512 Len=1460 [TCP segment of a reassembled PDU]"
"339","2.328882828","192.168.2.142","37.120.165.226","TCP","54","45294  >  443 [ACK] Seq=1104 Ack=121442 Win=175104 Len=0"
"340","2.328896206","37.120.165.226","192.168.2.142","TCP","2974","443  >  45294 [PSH, ACK] Seq=121442 Ack=1104 Win=32512 Len=2920 [TCP segment of a reassembled PDU]"
"341","2.328904136","192.168.2.142","37.120.165.226","TCP","54","45294  >  443 [ACK] Seq=1104 Ack=124362 Win=180992 Len=0"
"342","2.328916630","37.120.165.226","192.168.2.142","TCP","1514","443  >  45294 [PSH, ACK] Seq=124362 Ack=1104 Win=32512 Len=1460 [TCP segment of a reassembled PDU]"
"343","2.328922721","192.168.2.142","37.120.165.226","TCP","54","45294  >  443 [ACK] Seq=1104 Ack=125822 Win=183808 Len=0"
"344","2.328934921","37.120.165.226","192.168.2.142","TCP","1514","443  >  45294 [PSH, ACK] Seq=125822 Ack=1104 Win=32512 Len=1460 [TCP segment of a reassembled PDU]"
"345","2.328941560","192.168.2.142","37.120.165.226","TCP","54","45294  >  443 [ACK] Seq=1104 Ack=127282 Win=186752 Len=0"
"346","2.328953498","37.120.165.226","192.168.2.142","TCP","1514","443  >  45294 [PSH, ACK] Seq=127282 Ack=1104 Win=32512 Len=1460 [TCP segment of a reassembled PDU]"
"347","2.328959671","192.168.2.142","37.120.165.226","TCP","54","45294  >  443 [ACK] Seq=1104 Ack=128742 Win=189696 Len=0"
"348","2.328972482","37.120.165.226","192.168.2.142","TCP","1514","443  >  45294 [PSH, ACK] Seq=128742 Ack=1104 Win=32512 Len=1460 [TCP segment of a reassembled PDU]"
"349","2.328979392","192.168.2.142","37.120.165.226","TCP","54","45294  >  443 [ACK] Seq=1104 Ack=130202 Win=192640 Len=0"
"350","2.329232188","37.120.165.226","192.168.2.142","TCP","1514","443  >  45294 [PSH, ACK] Seq=130202 Ack=1104 Win=32512 Len=1460 [TCP segment of a reassembled PDU]"
"351","2.329241391","192.168.2.142","37.120.165.226","TCP","54","45294  >  443 [ACK] Seq=1104 Ack=131662 Win=195584 Len=0"
"352","2.329256079","37.120.165.226","192.168.2.142","TLSv1.2","315","Application Data [TCP segment of a reassembled PDU]"
"353","2.329263333","192.168.2.142","37.120.165.226","TCP","54","45294  >  443 [ACK] Seq=1104 Ack=131923 Win=198400 Len=0"
"354","2.329720011","37.120.165.226","192.168.2.142","TLSv1.2","1514","Application Data [TCP segment of a reassembled PDU]"
"355","2.329729425","192.168.2.142","37.120.165.226","TCP","54","45294  >  443 [ACK] Seq=1104 Ack=133383 Win=201344 Len=0"
"356","2.329842586","37.120.165.226","192.168.2.142","TLSv1.2","1514","Application Data [TCP segment of a reassembled PDU]"
"357","2.329852041","192.168.2.142","37.120.165.226","TCP","54","45294  >  443 [ACK] Seq=1104 Ack=134843 Win=204288 Len=0"
"358","2.329958842","37.120.165.226","192.168.2.142","TCP","1514","443  >  45294 [PSH, ACK] Seq=134843 Ack=1104 Win=32512 Len=1460 [TCP segment of a reassembled PDU]"
"359","2.329967311","192.168.2.142","37.120.165.226","TCP","54","45294  >  443 [ACK] Seq=1104 Ack=136303 Win=207232 Len=0"
"360","2.330354892","37.120.165.226","192.168.2.142","TCP","1514","443  >  45294 [PSH, ACK] Seq=136303 Ack=1104 Win=32512 Len=1460 [TCP segment of a reassembled PDU]"
"361","2.330364264","192.168.2.142","37.120.165.226","TCP","54","45294  >  443 [ACK] Seq=1104 Ack=137763 Win=210176 Len=0"
"362","2.330467849","37.120.165.226","192.168.2.142","TCP","1514","443  >  45294 [PSH, ACK] Seq=137763 Ack=1104 Win=32512 Len=1460 [TCP segment of a reassembled PDU]"
"363","2.330476676","192.168.2.142","37.120.165.226","TCP","54","45294  >  443 [ACK] Seq=1104 Ack=139223 Win=213120 Len=0"
"364","2.331459219","37.120.165.226","192.168.2.142","TCP","1514","443  >  45294 [PSH, ACK] Seq=139223 Ack=1104 Win=32512 Len=1460 [TCP segment of a reassembled PDU]"
"365","2.331470986","192.168.2.142","37.120.165.226","TCP","54","45294  >  443 [ACK] Seq=1104 Ack=140683 Win=215936 Len=0"
"366","2.331977771","37.120.165.226","192.168.2.142","TCP","1514","443  >  45294 [PSH, ACK] Seq=140683 Ack=1104 Win=32512 Len=1460 [TCP segment of a reassembled PDU]"
"367","2.331987436","192.168.2.142","37.120.165.226","TCP","54","45294  >  443 [ACK] Seq=1104 Ack=142143 Win=218880 Len=0"
"368","2.332140445","37.120.165.226","192.168.2.142","TCP","1514","443  >  45294 [PSH, ACK] Seq=142143 Ack=1104 Win=32512 Len=1460 [TCP segment of a reassembled PDU]"
"369","2.332149619","192.168.2.142","37.120.165.226","TCP","54","45294  >  443 [ACK] Seq=1104 Ack=143603 Win=221824 Len=0"
"370","2.333302530","37.120.165.226","192.168.2.142","TCP","1514","443  >  45294 [PSH, ACK] Seq=143603 Ack=1104 Win=32512 Len=1460 [TCP segment of a reassembled PDU]"
"371","2.333311897","192.168.2.142","37.120.165.226","TCP","54","45294  >  443 [ACK] Seq=1104 Ack=145063 Win=224768 Len=0"
"372","2.333332133","37.120.165.226","192.168.2.142","TCP","1514","443  >  45294 [PSH, ACK] Seq=145063 Ack=1104 Win=32512 Len=1460 [TCP segment of a reassembled PDU]"
"373","2.333338683","192.168.2.142","37.120.165.226","TCP","54","45294  >  443 [ACK] Seq=1104 Ack=146523 Win=227712 Len=0"
"374","2.333351223","37.120.165.226","192.168.2.142","TCP","1514","443  >  45294 [PSH, ACK] Seq=146523 Ack=1104 Win=32512 Len=1460 [TCP segment of a reassembled PDU]"
"375","2.333357594","192.168.2.142","37.120.165.226","TCP","54","45294  >  443 [ACK] Seq=1104 Ack=147983 Win=230528 Len=0"
"376","2.333370011","37.120.165.226","192.168.2.142","TCP","1514","443  >  45294 [PSH, ACK] Seq=147983 Ack=1104 Win=32512 Len=1460 [TCP segment of a reassembled PDU]"
"377","2.333376106","192.168.2.142","37.120.165.226","TCP","54","45294  >  443 [ACK] Seq=1104 Ack=149443 Win=233472 Len=0"
"378","2.333388319","37.120.165.226","192.168.2.142","TLSv1.2","1514","Application Data [TCP segment of a reassembled PDU]"
"379","2.333394453","192.168.2.142","37.120.165.226","TCP","54","45294  >  443 [ACK] Seq=1104 Ack=150903 Win=236416 Len=0"
"380","2.333894426","37.120.165.226","192.168.2.142","TCP","1514","443  >  45294 [PSH, ACK] Seq=150903 Ack=1104 Win=32512 Len=1460 [TCP segment of a reassembled PDU]"
"381","2.333904375","192.168.2.142","37.120.165.226","TCP","54","45294  >  443 [ACK] Seq=1104 Ack=152363 Win=239360 Len=0"
"382","2.333924763","37.120.165.226","192.168.2.142","TCP","1514","443  >  45294 [PSH, ACK] Seq=152363 Ack=1104 Win=32512 Len=1460 [TCP segment of a reassembled PDU]"
"383","2.333931718","192.168.2.142","37.120.165.226","TCP","54","45294  >  443 [ACK] Seq=1104 Ack=153823 Win=242304 Len=0"
"384","2.334057941","37.120.165.226","192.168.2.142","TCP","1514","443  >  45294 [ACK] Seq=153823 Ack=1104 Win=32512 Len=1460 [TCP segment of a reassembled PDU]"
"385","2.334065588","192.168.2.142","37.120.165.226","TCP","54","45294  >  443 [ACK] Seq=1104 Ack=155283 Win=245120 Len=0"
"386","2.334108180","37.120.165.226","192.168.2.142","TLSv1.2","264","Application Data, Application Data"
"387","2.334115026","192.168.2.142","37.120.165.226","TCP","54","45294  >  443 [ACK] Seq=1104 Ack=155493 Win=248064 Len=0"
"712","60.724945485","192.168.2.142","37.120.165.226","TLSv1.2","100","Application Data"
"713","60.725624676","37.120.165.226","192.168.2.142","TCP","60","443  >  45294 [ACK] Seq=155493 Ack=1150 Win=32512 Len=0"
"714","60.930141768","37.120.165.226","192.168.2.142","TLSv1.2","100","Application Data"
"715","60.930173167","192.168.2.142","37.120.165.226","TCP","54","45294  >  443 [ACK] Seq=1150 Ack=155539 Win=248064 Len=0"
"748","76.838594925","192.168.2.142","37.120.165.226","TLSv1.2","100","Application Data"
"756","76.840624295","37.120.165.226","192.168.2.142","TCP","60","443  >  45294 [ACK] Seq=155539 Ack=1196 Win=32512 Len=0"
"795","76.910902079","192.168.2.142","37.120.165.226","TLSv1.2","85","Encrypted Alert"
"799","76.911058014","192.168.2.142","37.120.165.226","TCP","54","45294  >  443 [FIN, ACK] Seq=1227 Ack=155539 Win=248064 Len=0"
"801","76.911293277","37.120.165.226","192.168.2.142","TCP","60","443  >  45294 [ACK] Seq=155539 Ack=1227 Win=32512 Len=0"
"802","76.911302266","37.120.165.226","192.168.2.142","TCP","60","443  >  45294 [FIN, ACK] Seq=155539 Ack=1228 Win=32512 Len=0"
"803","76.911310238","192.168.2.142","37.120.165.226","TCP","54","45294  >  443 [ACK] Seq=1228 Ack=155540 Win=248064 Len=0"
